Hash,Commit Message,Author Name,Author Email,Committor Name,Committor Email,Author Date,Author Timezone,Committor Date,Committor Timezone,in_main_branch,merge,modified_files,parents,deletions,insertions,lines,files,dmm_unit_size,dmm_unit_complexity,dmm_unit_interfacing
656a4e17e71b7492bdc6d00c6eaa6c0175724f45,Create README.md,T,tnvo@users.noreply.github.com,GitHub,noreply@github.com,2018-09-18 17:44:06-05:00,18000,2018-09-18 17:44:06-05:00,18000,True,False,['README.md'],[],0,104,104,1,,,
5c0b2acd94c4305efd0c316336a61e10c7254d20,huntlib initial project,tnvo,thaovo@email.arizona.edu,tnvo,thaovo@email.arizona.edu,2018-09-18 17:46:56-05:00,18000,2018-09-18 17:46:56-05:00,18000,True,False,"['.gitignore', 'CONTRIBUTING.md', 'LICENSE.txt', 'README.md', '__init__.py', 'elastic.py', 'splunk.py', 'requirements.txt', 'setup.cfg', 'setup.py', 'test_entropy.py']",['656a4e17e71b7492bdc6d00c6eaa6c0175724f45'],0,525,525,11,0.5612244897959183,0.5612244897959183,0.17346938775510204
f78b9140aedf3bb008eb09c059560f0fbbed0611,Update issue templates,T,tnvo@users.noreply.github.com,T,tnvo@users.noreply.github.com,2018-09-19 21:08:52-05:00,18000,2018-09-19 21:08:52-05:00,18000,True,False,"['bug_report.md', 'feature_request.md']",['5c0b2acd94c4305efd0c316336a61e10c7254d20'],0,52,52,2,,,
76ede03b944bd4421ae4948e561f29ea737bbe9b,Create CODE_OF_CONDUCT.md,T,tnvo@users.noreply.github.com,GitHub,noreply@github.com,2018-09-24 14:36:10-05:00,18000,2018-09-24 14:36:10-05:00,18000,True,False,['CODE_OF_CONDUCT.md'],['f78b9140aedf3bb008eb09c059560f0fbbed0611'],0,74,74,1,,,
d60d5fc6c1c3a666fa29fec6c9960cdfab904260,Added slack invite link to workspace,Thao Vo,tnvo@users.noreply.github.com,GitHub,noreply@github.com,2018-10-01 15:13:06-05:00,18000,2018-10-01 15:13:06-05:00,18000,True,False,['README.md'],['76ede03b944bd4421ae4948e561f29ea737bbe9b'],0,2,2,1,,,
589ec1bcead8e9b3c941deebf401573be1001f16,"Added new edit_distance() function 

Calculate the edit distance between two strings, according to a number 
of different algorithms.",David J. Bianco,davidjbianco@gmail.com,David J. Bianco,davidjbianco@gmail.com,2018-10-03 19:32:44-04:00,14400,2018-10-03 19:32:44-04:00,14400,True,False,"['__init__.py', 'requirements.txt', 'setup.py', 'test_edit_distance.py']",['d60d5fc6c1c3a666fa29fec6c9960cdfab904260'],2,124,126,4,0.625,0.625,0.625
504416e3716f6e7912dcd34f71a5dddfa513ffcc,Updated to include edit_distance() docs,David J. Bianco,davidjbianco@gmail.com,David J. Bianco,davidjbianco@gmail.com,2018-10-03 19:49:59-04:00,14400,2018-10-03 19:49:59-04:00,14400,True,False,['README.md'],['589ec1bcead8e9b3c941deebf401573be1001f16'],0,23,23,1,,,
ffdd41f12448d590524188391770a8a3e7c6186d,Bump version to reflect recent additions.,David J. Bianco,davidjbianco@gmail.com,David J. Bianco,davidjbianco@gmail.com,2018-10-03 20:45:00-04:00,14400,2018-10-03 20:45:00-04:00,14400,True,False,['setup.py'],['504416e3716f6e7912dcd34f71a5dddfa513ffcc'],1,1,2,1,,,
5391d4a2a06b67f3c2c3c58d9ec18de128878877,Added support for publishing to PyPi,David J. Bianco,davidjbianco@gmail.com,David J. Bianco,davidjbianco@gmail.com,2018-10-03 20:58:00-04:00,14400,2018-10-03 20:58:00-04:00,14400,True,False,['setup.py'],['ffdd41f12448d590524188391770a8a3e7c6186d'],2,13,15,1,,,
4686b1d2f3dbe007119bf7e31d85bdfbe1934613,"Support for the 'limit' search param

Specifying 'limit=' to ElasticDF.search() or ElasticDF.search_df() will 
now limit the number of search results returned, perhaps also making the 
query return more quickly.",David J. Bianco,davidjbianco@gmail.com,David J. Bianco,davidjbianco@gmail.com,2018-10-17 13:52:37-04:00,14400,2018-10-17 13:52:37-04:00,14400,True,False,['elastic.py'],['5391d4a2a06b67f3c2c3c58d9ec18de128878877'],7,15,22,1,0.5,0.5,0.0
921b4a543891586da9bcd5737dfad3850da4f85c,Doc correction for limit param,David J. Bianco,davidjbianco@gmail.com,David J. Bianco,davidjbianco@gmail.com,2018-10-17 13:53:07-04:00,14400,2018-10-17 13:53:07-04:00,14400,True,False,['elastic.py'],['4686b1d2f3dbe007119bf7e31d85bdfbe1934613'],0,2,2,1,,,
62d9295a292370351eef3fda7e832e898673cf7f,"New 'limit=' support for SplunkDF

You can now specify the 'limit=' paramater to SplunkDF.search() or 
SplunkDF.search_df() to limit the number of search results retrieved, 
which will probably make the query complete more quickly too.  

One important note is that without 'limit', SplunkDF will use an 
'export' search, which returns ALL search results.  But 'export' 
searches don't support the 'count' paramter, which underlies 'limit'.  
If you supply a 'limit', SplunkDF will instead use a 'oneshot' search.  
The limit will be honored, but is also subject to a server side max 
(default 50,000 if it's not overridden in limits.conf).  So if you want 
to use limit, don't limit to anything more than 50000.",David J. Bianco,davidjbianco@gmail.com,David J. Bianco,davidjbianco@gmail.com,2018-10-17 14:52:37-04:00,14400,2018-10-17 14:52:37-04:00,14400,True,False,['splunk.py'],['921b4a543891586da9bcd5737dfad3850da4f85c'],5,17,22,1,0.2,0.2,0.0
310105621b261686ab653201cc8286d9820bbff1,Added new documentation for the ElasticDF and SplunkDF 'limit' parameter.,David J. Bianco,davidjbianco@gmail.com,David J. Bianco,davidjbianco@gmail.com,2018-10-17 15:05:27-04:00,14400,2018-10-17 15:05:27-04:00,14400,True,False,['README.md'],['62d9295a292370351eef3fda7e832e898673cf7f'],23,61,84,1,,,
922a9f32061c4583004bfd80ea2773aa13614c44,Add syntax highlighting,Danny Feliz,dannyfeliz08@gmail.com,GitHub,noreply@github.com,2018-10-18 10:38:41-04:00,14400,2018-10-18 10:38:41-04:00,14400,True,False,['README.md'],['5391d4a2a06b67f3c2c3c58d9ec18de128878877'],31,32,63,1,,,
7b8e326e7feb864dbb4966a0c13ab01ad8ff9d9b,Improved error handling for ElasticDF,David J. Bianco,davidjbianco@gmail.com,David J. Bianco,davidjbianco@gmail.com,2018-10-22 15:49:55-04:00,14400,2018-10-22 15:49:55-04:00,14400,True,False,"['elastic.py', 'exceptions.py']",['310105621b261686ab653201cc8286d9820bbff1'],2,37,39,2,0.0,0.0,0.0
ab9462bd6580c8819afe62da14a3c5381bb39075,Added info about new exception handling to docstring for ElasticDF,David J. Bianco,davidjbianco@gmail.com,David J. Bianco,davidjbianco@gmail.com,2018-10-22 15:54:41-04:00,14400,2018-10-22 15:54:41-04:00,14400,True,False,['elastic.py'],['7b8e326e7feb864dbb4966a0c13ab01ad8ff9d9b'],0,8,8,1,,,
6ee171910a1b3918a2cf9eeda74247a9f8560b77,"Added exceptions authentication issues

ElasticDF and SplunkDF can now throw an 
AuthenticationErrorSearchException if the remote login fails. Due to the 
difference in how the underlying libraries handle authentication, 
SplunkDF will throw this during object initialization, but ElasticDF 
will throw it during a search.

ElasticDF can now also throw a",David J. Bianco,davidjbianco@gmail.com,David J. Bianco,davidjbianco@gmail.com,2018-10-23 11:20:00-04:00,14400,2018-10-23 11:20:00-04:00,14400,True,False,"['README.md', 'elastic.py', 'exceptions.py', 'splunk.py']",['ab9462bd6580c8819afe62da14a3c5381bb39075'],83,136,219,4,0.625,0.625,0.0
5b2c9db9cafd0fcdfdf38de30c4e518a267ab1b0,Doc and docstring updates for new exceptions,David J. Bianco,davidjbianco@gmail.com,David J. Bianco,davidjbianco@gmail.com,2018-10-23 11:44:37-04:00,14400,2018-10-23 11:44:37-04:00,14400,True,False,"['README.md', 'elastic.py', 'splunk.py']",['0384af3042584b1f288d1afa371f7ccc2799e472'],8,32,40,3,,,
6e7fb963f44022738aceb696ee75e72d7fa408e3,Bump version to 0.3.0,David J. Bianco,davidjbianco@gmail.com,David J. Bianco,davidjbianco@gmail.com,2018-10-23 11:46:55-04:00,14400,2018-10-23 11:46:55-04:00,14400,True,False,['setup.py'],['5b2c9db9cafd0fcdfdf38de30c4e518a267ab1b0'],1,1,2,1,,,
1ebac152b37b1dbbb448598045cb53102934732e,"Support for `fields` arg and fixed deprecated json normalization method.

Splunk's default behavior seems to have changed since this module was written.  In particular, you no
longer get all the fields in the search results by default, only those you specifically search on or those you ask for in a '| fields=' stanza.  For a quick workaround, SplunkDF.search() and .search_df()
now allow you to specified the 'fields' argument, which is a comma-separated list of fields you want.
By default, we use '*' for this arg, which means all fields.  It's literally adding '| fields=*'
to the end of each query by default.  If for some reason this doesn't work well for you, you can
set 'fields=None' when you call the search functions and it won't modify the query at all.

Also, the old pandas way of normalizing JSON data (pd.io.json.json_normalize) has been replaced with
the newer pd.json_normalize() function.",David J. Bianco,davidjbianco@gmail.com,David J. Bianco,davidjbianco@gmail.com,2020-04-30 16:20:45-04:00,14400,2020-04-30 16:20:45-04:00,14400,True,False,['splunk.py'],['6e7fb963f44022738aceb696ee75e72d7fa408e3'],5,10,15,1,0.25,0.25,0.0
92b41e959980a94e587932b026aaa45d07e047fc,"Updated testing framework to 'tox' and added basic SplunkDF tests.

The new test suite can now test SplunkDF.  It spins up a Splunk Enterprise Docker container,
loads data and then tests searches against that.  It does mean you need a Splunk Enterprise
Developers license to run those tests, though.",David J. Bianco,davidjbianco@gmail.com,David J. Bianco,davidjbianco@gmail.com,2020-04-30 16:25:16-04:00,14400,2020-04-30 16:25:16-04:00,14400,True,False,"['.gitignore', 'test-data.json', 'test_splunk_df.py', 'tox.ini']",['1ebac152b37b1dbbb448598045cb53102934732e'],0,157,157,4,1.0,1.0,1.0
e00596d69097669327bc04af2190d2449028d19b,Added SplunkDF() `fields` docs to code and README,David J. Bianco,davidjbianco@gmail.com,David J. Bianco,davidjbianco@gmail.com,2020-04-30 17:19:31-04:00,14400,2020-04-30 17:19:31-04:00,14400,True,False,"['README.md', 'splunk.py']",['92b41e959980a94e587932b026aaa45d07e047fc'],0,25,25,2,,,
69b897e7032a817facc15b144b4177c47afed19e,Ignore VS Code directory,David J. Bianco,davidjbianco@gmail.com,David J. Bianco,davidjbianco@gmail.com,2020-05-04 12:36:06-04:00,14400,2020-05-04 12:36:06-04:00,14400,True,False,['.gitignore'],['e00596d69097669327bc04af2190d2449028d19b'],0,4,4,1,,,
c1b77840e416a8807b402e7157222ca43e4d18ef,Support for basic Elasticsearch tests against containerized ES instance.,David J. Bianco,davidjbianco@gmail.com,David J. Bianco,davidjbianco@gmail.com,2020-05-04 12:36:37-04:00,14400,2020-05-04 12:36:37-04:00,14400,True,False,"['elastic.py', 'instances.yml', 'test-data-elastic.json', 'test_elastic_df.py', 'tox.ini']",['69b897e7032a817facc15b144b4177c47afed19e'],10,168,178,5,0.7377049180327869,1.0,1.0
f159ae4886347fcddf5b07bc48e7876ba83d486e,Unit tests use python3.8,David J. Bianco,davidjbianco@gmail.com,David J. Bianco,davidjbianco@gmail.com,2020-06-09 10:48:37-04:00,14400,2020-06-09 10:48:37-04:00,14400,True,False,['tox.ini'],['c1b77840e416a8807b402e7157222ca43e4d18ef'],1,2,3,1,,,
75f56a0704f7214273218d3bf5ae751db616026b,Bump to v0.3.1,David J. Bianco,davidjbianco@gmail.com,David J. Bianco,davidjbianco@gmail.com,2020-06-09 10:54:05-04:00,14400,2020-06-09 10:54:05-04:00,14400,True,False,['setup.py'],['f159ae4886347fcddf5b07bc48e7876ba83d486e'],1,1,2,1,,,
14ecf21f8135260e95567a7de9540414976f4a7f,Updated jellyfish req to avoid deprecation warning.,David J. Bianco,davidjbianco@gmail.com,David J. Bianco,davidjbianco@gmail.com,2020-06-09 11:21:24-04:00,14400,2020-06-09 11:21:24-04:00,14400,True,False,['requirements.txt'],['48e460a11e9df7ab68f3d9f2899dfc753a69622b'],1,1,2,1,,,
36eae8f90966fa6e1692a276eeecf03448c7d554,Bump jellyfish to >= 0.8.2 to avoid deprecation warnings,David J. Bianco,davidjbianco@gmail.com,David J. Bianco,davidjbianco@gmail.com,2020-06-09 11:46:31-04:00,14400,2020-06-09 11:46:31-04:00,14400,True,False,"['__init__.py', 'setup.py']",['14ecf21f8135260e95567a7de9540414976f4a7f'],6,5,11,2,,,
2220b1e407344c6cbfa9c7fe6f375e43c83f05a3,"New huntlib.data module provides multi-file capable read_csv() and read_json()

The new huntlib.data module provides convenience functions to make it easier to deal with data
files.  The first two functions are wildcard-capable replacements for pandas' read_csv() and
read_json() functions.  The new versions operate identically and accept all the same parameters
(they're just passed through to the underlying pandas functions) but the filename can contain
wildcards for reading multiple files.",David J. Bianco,davidjbianco@gmail.com,David J. Bianco,davidjbianco@gmail.com,2020-06-09 12:54:53-04:00,14400,2020-06-09 12:54:53-04:00,14400,True,False,"['README.md', '__init__.py', 'data.py', 'setup.py', 'test-data-1.csv', 'test-data-2.csv', 'test_multi_reads.py']",['36eae8f90966fa6e1692a276eeecf03448c7d554'],2,145,147,7,1.0,1.0,0.3076923076923077
1cdb8d90c183831e3f2004cc82ee9008bf39d6eb,Added long_description_content_type to avoid PyPi parser errors.,David J. Bianco,davidjbianco@gmail.com,David J. Bianco,davidjbianco@gmail.com,2020-06-09 13:22:04-04:00,14400,2020-06-09 13:22:04-04:00,14400,True,False,['setup.py'],['2220b1e407344c6cbfa9c7fe6f375e43c83f05a3'],0,1,1,1,,,
8c5e42cffa2e2d0bb321ca1e5085a79820e710f9,Fixed weird quoting in Splunk container startup command.,David J. Bianco,davidjbianco@gmail.com,David J. Bianco,davidjbianco@gmail.com,2020-06-09 15:24:30-04:00,14400,2020-06-09 15:24:30-04:00,14400,True,False,['tox.ini'],['48157b8bee25201f01f67d54e2aacb2e3882a4db'],1,1,2,1,,,
35640fbb700fc9beb63521fdda74dc8b897ec5b2,Fixed minor indentation error in SplunkDF.search() docstring.,David J. Bianco,davidjbianco@gmail.com,David J. Bianco,davidjbianco@gmail.com,2020-06-09 16:05:24-04:00,14400,2020-06-09 16:05:24-04:00,14400,True,False,['splunk.py'],['8c5e42cffa2e2d0bb321ca1e5085a79820e710f9'],1,1,2,1,,,
49bad705920ea02c9753e8801b5becef8d931bdc,Added internal_fields param to SplunkDF to support dropping internal Splunk fields,David J. Bianco,davidjbianco@gmail.com,David J. Bianco,davidjbianco@gmail.com,2020-06-11 11:13:22-04:00,14400,2020-06-11 11:13:22-04:00,14400,True,False,"['splunk.py', 'test_splunk_df.py']",['11a9639cb4e7e0a3977dedf64b191a277f341dc2'],3,78,81,2,0.0,0.782608695652174,0.782608695652174
3974c821e2cf41aa956ac338a304f7065942d920,Updated docs and bumped version to 0.4.1,David J. Bianco,davidjbianco@gmail.com,David J. Bianco,davidjbianco@gmail.com,2020-06-11 12:00:22-04:00,14400,2020-06-11 12:00:22-04:00,14400,True,False,"['README.md', 'setup.py']",['9df0a3b16671c2be6dfe57da2e8ececfd37ba6fe'],3,23,26,2,,,
b20b8b692193c8107566a9837a62fda0b345547d,"Set multiprocessing start method to ""fork"" on OS X systems.",David J. Bianco,davidjbianco@gmail.com,David J. Bianco,davidjbianco@gmail.com,2020-06-15 16:13:18-04:00,14400,2020-06-15 16:13:18-04:00,14400,True,False,['__init__.py'],['3974c821e2cf41aa956ac338a304f7065942d920'],0,12,12,1,,,
43134082a89c188682977018fea3946878fa5901,Added basic multiprocessing search_df() test.,David J. Bianco,davidjbianco@gmail.com,David J. Bianco,davidjbianco@gmail.com,2020-06-15 16:15:09-04:00,14400,2020-06-15 16:15:09-04:00,14400,True,False,['test_splunk_df.py'],['b20b8b692193c8107566a9837a62fda0b345547d'],0,27,27,1,0.0,1.0,1.0
880d2e8d2d74c4469c9cd5bbc08f27c35c290298,Experimental multiprocessing support for searches,David J. Bianco,davidjbianco@gmail.com,David J. Bianco,davidjbianco@gmail.com,2020-06-15 16:39:03-04:00,14400,2020-06-15 16:39:03-04:00,14400,True,False,['splunk.py'],['43134082a89c188682977018fea3946878fa5901'],36,111,147,1,0.0,0.8936170212765957,0.0
01733fdf8c954bf192b1eb5c5bc1a4b408070ce0,Don't require limit param to use parallel search.,David J. Bianco,davidjbianco@gmail.com,David J. Bianco,davidjbianco@gmail.com,2020-06-16 09:36:04-04:00,14400,2020-06-16 09:36:04-04:00,14400,True,False,['splunk.py'],['880d2e8d2d74c4469c9cd5bbc08f27c35c290298'],1,2,3,1,0.0,0.0,0.0
24b0229dec507ad7380ee679a0b9758c4fbfcd82,Updates to SplunkDF parallel & large result set tests.,David J. Bianco,davidjbianco@gmail.com,David J. Bianco,davidjbianco@gmail.com,2020-06-16 19:08:24-04:00,14400,2020-06-16 19:08:24-04:00,14400,True,False,"['test-data-large.json', 'test_multi_reads.py', 'test_splunk_df.py', 'tox.ini']",['01733fdf8c954bf192b1eb5c5bc1a4b408070ce0'],8,1000040,1000048,4,1.0,1.0,1.0
9b4f589939864840da739096e82f41581e5b971a,"Ditch the Splunk oneshot() API

The Splunk oneshot() API was super slow (seemingly CPU bound). Removed
it entirely and now use Splunk's Jobs API to retrieve results when the
'limit' paramter is specified. Further, we always use multiprocessing
in these cases, even if just with the default worker count of 1.
Limit searches are *much* faster now. Searches with no limit
specified still use the Splunk export() API, which is slower, but
ensures that all results are retrieved.",David J. Bianco,davidjbianco@gmail.com,David J. Bianco,davidjbianco@gmail.com,2020-06-17 08:00:20-04:00,14400,2020-06-17 08:00:20-04:00,14400,True,False,['splunk.py'],['24b0229dec507ad7380ee679a0b9758c4fbfcd82'],29,25,54,1,1.0,0.0,1.0
dcfe91c761c070119331fe65c30359ee30711577,Updated row count for test_read_json after adding new test data.,David J. Bianco,davidjbianco@gmail.com,David J. Bianco,davidjbianco@gmail.com,2020-06-17 08:52:36-04:00,14400,2020-06-17 08:52:36-04:00,14400,True,False,['test_multi_reads.py'],['9b4f589939864840da739096e82f41581e5b971a'],2,2,4,1,,,
500c93ee878d72731bca4964e46b3c94e2821a38,Added host.docker.internal as a valid hostname for the SSL cert,David J. Bianco,davidjbianco@gmail.com,David J. Bianco,davidjbianco@gmail.com,2020-06-17 12:48:18-04:00,14400,2020-06-17 12:48:18-04:00,14400,True,False,['instances.yml'],['dcfe91c761c070119331fe65c30359ee30711577'],0,1,1,1,,,
39247f907fb196f66e1f2ac381115d30764f1d9c,"Updated elastic data load to add ""bigdata"" index and not print all loaded data",David J. Bianco,davidjbianco@gmail.com,David J. Bianco,davidjbianco@gmail.com,2020-06-17 12:49:04-04:00,14400,2020-06-17 12:49:04-04:00,14400,True,False,['tox.ini'],['500c93ee878d72731bca4964e46b3c94e2821a38'],1,2,3,1,,,
5111e67f64ca86c7b0dfb076fe97d411a45c171f,"Elastic test data for ""bigdata"" index",David J. Bianco,davidjbianco@gmail.com,David J. Bianco,davidjbianco@gmail.com,2020-06-17 12:49:54-04:00,14400,2020-06-17 12:49:54-04:00,14400,True,False,['test-data-large-elastic.json'],['39247f907fb196f66e1f2ac381115d30764f1d9c'],0,2000000,2000000,1,,,
d77cb7eac1f621e41ff3a8579203531e924bc7a9,First draft multiprocessing support,David J. Bianco,davidjbianco@gmail.com,David J. Bianco,davidjbianco@gmail.com,2020-06-17 12:50:19-04:00,14400,2020-06-17 12:50:19-04:00,14400,True,False,['elastic.py'],['5111e67f64ca86c7b0dfb076fe97d411a45c171f'],6,62,68,1,0.32432432432432434,0.32432432432432434,0.0
0e5417ddf71bf3f15a05a8c496fbfdf8595f5262,Make scroll window a param to search() and search_df(),David J. Bianco,davidjbianco@gmail.com,David J. Bianco,davidjbianco@gmail.com,2020-06-17 12:55:05-04:00,14400,2020-06-17 12:55:05-04:00,14400,True,False,['elastic.py'],['d77cb7eac1f621e41ff3a8579203531e924bc7a9'],4,6,10,1,0.0,0.5,0.0
6c54d59a707aa441638c6d2cf19342e3ec0f5783,Added basic parallel search test.,David J. Bianco,davidjbianco@gmail.com,David J. Bianco,davidjbianco@gmail.com,2020-06-17 12:55:26-04:00,14400,2020-06-17 12:55:26-04:00,14400,True,False,['test_elastic_df.py'],['0e5417ddf71bf3f15a05a8c496fbfdf8595f5262'],0,25,25,1,0.0,1.0,1.0
85f46e822c9b9aae10fab716094fc5c4e577b1c6,Reverting elastic to non-multiprocess code.  MP actually makes performance worse!,David J. Bianco,davidjbianco@gmail.com,David J. Bianco,davidjbianco@gmail.com,2020-06-17 15:01:54-04:00,14400,2020-06-17 15:01:54-04:00,14400,True,False,"['elastic.py', 'test_elastic_df.py']",['6c54d59a707aa441638c6d2cf19342e3ec0f5783'],89,6,95,2,1.0,0.4727272727272727,0.7090909090909091
369c5917cdc66a46e543765406f85ceb51fb09a5,Added test of parallel search for 1m rows,David J. Bianco,davidjbianco@gmail.com,David J. Bianco,davidjbianco@gmail.com,2020-06-17 17:37:23-04:00,14400,2020-06-17 17:37:23-04:00,14400,True,False,['test_splunk_df.py'],['85f46e822c9b9aae10fab716094fc5c4e577b1c6'],0,26,26,1,1.0,1.0,1.0
6de92fff77841ae787d306d5d83054a1816fd970,Added HUNTLIB_* to passenv spec to enable extended testing via tox command.,David J. Bianco,davidjbianco@gmail.com,David J. Bianco,davidjbianco@gmail.com,2020-06-17 17:37:49-04:00,14400,2020-06-17 17:37:49-04:00,14400,True,False,['tox.ini'],['369c5917cdc66a46e543765406f85ceb51fb09a5'],0,2,2,1,,,
2a79638346283f77a952cc24887ed10b1f527394,Added multiprocessing supports docs for SplunkDF,David J. Bianco,davidjbianco@gmail.com,David J. Bianco,davidjbianco@gmail.com,2020-06-18 11:05:15-04:00,14400,2020-06-18 11:05:15-04:00,14400,True,False,['README.md'],['6de92fff77841ae787d306d5d83054a1816fd970'],0,21,21,1,,,
d7fea1a67c753d09084a89906a0cf1c96babbece,Minor code fixes to avoid pylint complaints,David J. Bianco,davidjbianco@gmail.com,David J. Bianco,davidjbianco@gmail.com,2020-06-18 11:05:47-04:00,14400,2020-06-18 11:05:47-04:00,14400,True,False,"['elastic.py', 'splunk.py']",['2a79638346283f77a952cc24887ed10b1f527394'],2,2,4,2,,,
c8353dff229c69777a4e88939fd5db1a237ae45b,"Smarter arg handling for search/search_df and unified results handling for all search types.

The search() and search_df() functions now use 'args' and 'kwargs' to handle their args, which
makes it MUCH easier to pass the searches through.  Changes to the search() code also to provide
basic sanity checking on the args, including enforcing the previous default values.

Both parallel and export() searches now use common code to process their results.  This was not
previously the case, leading to bad things like Splunk messages not being handled consistently,
internal fields not being filtered correctly, etc.",David J. Bianco,davidjbianco@gmail.com,David J. Bianco,davidjbianco@gmail.com,2020-06-18 12:49:34-04:00,14400,2020-06-18 12:49:34-04:00,14400,True,False,['splunk.py'],['d7fea1a67c753d09084a89906a0cf1c96babbece'],81,107,188,1,0.6764705882352942,0.0,0.0
6796bb8e9c318df34eb68eff85cb24fc8c5a0d12,Bumped version to 0.4.5,David J. Bianco,davidjbianco@gmail.com,David J. Bianco,davidjbianco@gmail.com,2020-06-19 08:48:00-04:00,14400,2020-06-19 08:48:00-04:00,14400,True,False,['setup.py'],['c8353dff229c69777a4e88939fd5db1a237ae45b'],1,1,2,1,,,
5d778999f413e3b1a5c7970322e2d704efbe5d8c,Better testing of uni- and multi-processing versions of the same searches.,David J. Bianco,davidjbianco@gmail.com,David J. Bianco,davidjbianco@gmail.com,2020-06-19 08:48:36-04:00,14400,2020-06-19 08:48:36-04:00,14400,True,False,['test_splunk_df.py'],['6796bb8e9c318df34eb68eff85cb24fc8c5a0d12'],25,125,150,1,0.38461538461538464,1.0,1.0
21d1ae21e9bb216197850602a336db6961658dd6,Pass HUNTLIB_* env variables to tests for control.,David J. Bianco,davidjbianco@gmail.com,David J. Bianco,davidjbianco@gmail.com,2020-06-19 08:49:05-04:00,14400,2020-06-19 08:49:05-04:00,14400,True,False,['tox.ini'],['5d778999f413e3b1a5c7970322e2d704efbe5d8c'],2,1,3,1,,,
5230c74f94909cddc180da009d309426103e0c41,"Pass all HUNTLIB_* env vars to tox, for future expandability.",David J. Bianco,davidjbianco@gmail.com,David J. Bianco,davidjbianco@gmail.com,2020-06-22 09:56:09-04:00,14400,2020-06-22 09:56:09-04:00,14400,True,False,['tox.ini'],['d3a029c6cba89be147da4e9d81176a6fed3467f7'],1,2,3,1,,,
6a35a350bedbd186c0df19604ed21699b5df9079,Removed extraneous comment (old setup command line no longer needed),David J. Bianco,davidjbianco@gmail.com,David J. Bianco,davidjbianco@gmail.com,2020-07-09 11:22:08-04:00,14400,2020-07-09 11:22:08-04:00,14400,True,False,['tox.ini'],['5230c74f94909cddc180da009d309426103e0c41'],1,0,1,1,,,
f9c2f70dfdd0b8a81953fb6abd8aa54667a17553,Added dependency for domaintools Python API,David J. Bianco,davidjbianco@gmail.com,David J. Bianco,davidjbianco@gmail.com,2020-07-09 11:22:30-04:00,14400,2020-07-09 11:22:30-04:00,14400,True,False,['requirements.txt'],['6a35a350bedbd186c0df19604ed21699b5df9079'],0,1,1,1,,,
2b4606c2c09a2ba9a8b6bf5d0d7adf3ba7256a5b,Added dependency for domaintools Python API,David J. Bianco,davidjbianco@gmail.com,David J. Bianco,davidjbianco@gmail.com,2020-07-09 11:22:53-04:00,14400,2020-07-09 11:22:53-04:00,14400,True,False,['setup.py'],['f9c2f70dfdd0b8a81953fb6abd8aa54667a17553'],1,2,3,1,,,
c1e290df69aaebeaff34471439e303f59a89b92d,Initial working domaintools module. Most API features not yet present.,David J. Bianco,davidjbianco@gmail.com,David J. Bianco,davidjbianco@gmail.com,2020-07-09 11:26:13-04:00,14400,2020-07-09 11:26:13-04:00,14400,True,False,"['domaintools.py', 'huntlibrc-sample', 'test_domaintools.py', 'test_multi_reads.py', 'test_splunk_df.py']",['2b4606c2c09a2ba9a8b6bf5d0d7adf3ba7256a5b'],371,389,760,5,0.0,0.0,0.0
a66b3df3333ed8c93c6c8281bf64cfb4bf198d95,Added domain profile & reputation lookups.  Also enhanced enrichment.,David J. Bianco,davidjbianco@gmail.com,David J. Bianco,davidjbianco@gmail.com,2020-07-09 17:06:31-04:00,14400,2020-07-09 17:06:31-04:00,14400,True,False,['domaintools.py'],['c1e290df69aaebeaff34471439e303f59a89b92d'],9,63,72,1,0.5,0.5,0.0
f00481be54d3f1e02124bc08d803c9f0bb7adbd4,Updated tests for domain reputation,David J. Bianco,davidjbianco@gmail.com,David J. Bianco,davidjbianco@gmail.com,2020-07-09 17:07:10-04:00,14400,2020-07-09 17:07:10-04:00,14400,True,False,['test_domaintools.py'],['a66b3df3333ed8c93c6c8281bf64cfb4bf198d95'],1,36,37,1,0.0,1.0,1.0
a9cbe30292a1232d8f3a87a59ce3de5d181fb050,Added tqdm dependency,David J. Bianco,davidjbianco@gmail.com,David J. Bianco,davidjbianco@gmail.com,2020-07-10 10:55:15-04:00,14400,2020-07-10 10:55:15-04:00,14400,True,False,"['requirements.txt', 'setup.py']",['f00481be54d3f1e02124bc08d803c9f0bb7adbd4'],1,3,4,2,,,
709a8f5fba111ea85541813138323d964a88a59f,Added risk() method and risk scoring to enrichment.,David J. Bianco,davidjbianco@gmail.com,David J. Bianco,davidjbianco@gmail.com,2020-07-10 16:31:12-04:00,14400,2020-07-10 16:31:12-04:00,14400,True,False,['domaintools.py'],['a9cbe30292a1232d8f3a87a59ce3de5d181fb050'],3,45,48,1,0.59375,0.59375,0.0
