Hash,Commit Message,Author Name,Author Email,Committor Name,Committor Email,Author Date,Author Timezone,Committor Date,Committor Timezone,in_main_branch,merge,modified_files,parents,deletions,insertions,lines,files,dmm_unit_size,dmm_unit_complexity,dmm_unit_interfacing
2cd2a39234a7b0af9fdb57dbabf4aa58bba1d542,"DIFFEO-586: Better handling of None in default_config

If your Configurable object says default_config={'foo': None}, don't delete
'foo' from the config that gets passed in if you dump the config and reload
it.  This also affects AutoFactory children with __init__(self, foo=None).

This is a mild change in overlay_config() where overlaying {'foo': None}
over itself yields 'foo' out, as an exception to the ""None means delete"" rule.",David Maze,dmaze@diffeo.com,David Maze,dmaze@diffeo.com,2015-04-09 12:14:30-04:00,14400,2015-04-09 12:14:30-04:00,14400,True,False,"['merge.py', 'test_configurable.py', 'test_merge.py', 'toplevel.py']",['3e30071ae558081454834c7f27e650a8dd008333'],120,207,327,4,0.8928571428571429,1.0,0.8928571428571429
6e3220af34f9e13d0f0ca6ea8baa130d4c50c1fe,Python 3 compatibility,David Maze,dmaze@diffeo.com,David Maze,dmaze@diffeo.com,2015-04-09 19:56:35+00:00,0,2015-04-09 19:56:35+00:00,0,True,False,"['tox.ini', 'version.py', 'factory.py', 'merge.py', 'test_configurable.py', 'test_factory.py', 'test_yakonfig.py', 'toplevel.py', 'yakonfig.py']",['2cd2a39234a7b0af9fdb57dbabf4aa58bba1d542'],69,78,147,9,0.0,0.0,0.0
094219d8ed9480cd7ffbb62772a318f387aceeef,inserting {0} style indexing into all .format statements to support python2.6,John R. Frank,jrf@diffeo.com,John R. Frank,jrf@diffeo.com,2015-04-12 06:36:28+00:00,0,2015-04-12 06:36:28+00:00,0,True,False,"['cmd.py', 'configurable.py', 'test_configurable.py', 'toplevel.py']",['6e3220af34f9e13d0f0ca6ea8baa130d4c50c1fe'],11,11,22,4,,,
20836065cc942cd8e8c1eb07b404cbbbd23ccdc3,adding `pexpect` to tests_require,John R. Frank,jrf@diffeo.com,John R. Frank,jrf@diffeo.com,2015-04-12 07:40:30+00:00,0,2015-04-12 07:40:30+00:00,0,True,False,['setup.py'],['094219d8ed9480cd7ffbb62772a318f387aceeef'],0,3,3,1,,,
4ebf516bd67baf43979c0aaa9ded5124384efe2e,converting dict comprehensions to dict constructors for python2.6,John R. Frank,jrf@diffeo.com,John R. Frank,jrf@diffeo.com,2015-04-12 07:40:40+00:00,0,2015-04-12 07:40:40+00:00,0,True,False,['factory.py'],['20836065cc942cd8e8c1eb07b404cbbbd23ccdc3'],2,2,4,1,,,
efca71498db07dec1fcd30b8dc1fb45995907e4c,"Support Python 2.6; remove !include_func.

yakonfig previously supported syntax where the result of a Python function
call could be inserted into the generated configuration.  This is a bad
idea for several reasons, and to my knowledge it's unused.  If you really
need it, yakonfig doesn't use ""safe"" PyYAML mode, so you can use
!!python/object/apply:module.function [param, param, ...]
to the same effect.

This used the importlib module, which was new in Python 2.7.  Removing this
makes all tests pass on Python 2.6.",David Maze,dmaze@diffeo.com,David Maze,dmaze@diffeo.com,2015-04-14 16:19:00+00:00,0,2015-04-14 16:19:00+00:00,0,True,False,"['tox.ini', 'yakonfig.py']",['4ebf516bd67baf43979c0aaa9ded5124384efe2e'],28,1,29,2,1.0,0.0,0.0
8122a650744a6cb93c9c00256d51d6b5b48b9d2c,Depend on 'importlib' for Python 2.6,David Maze,dmaze@diffeo.com,David Maze,dmaze@diffeo.com,2015-04-27 09:56:13-04:00,14400,2015-04-27 09:57:08-04:00,14400,True,False,['setup.py'],['efca71498db07dec1fcd30b8dc1fb45995907e4c'],0,1,1,1,,,
cc08beed10704bbc2e518ae8792a85738c5bb142,Make version.py work with Python 2.6 too,David Maze,dmaze@diffeo.com,David Maze,dmaze@diffeo.com,2015-04-27 10:00:24-04:00,14400,2015-04-27 10:00:24-04:00,14400,True,False,['version.py'],['8122a650744a6cb93c9c00256d51d6b5b48b9d2c'],1,1,2,1,,,
82411dce2eeb37c5785bea9166817a92ac9b9a3e,more and better logging that helped me find a misconfiguration bug today,Brian Olson,bolson@diffeo.com,Brian Olson,bolson@diffeo.com,2015-05-22 16:20:57+00:00,0,2015-05-22 16:20:57+00:00,0,True,False,['toplevel.py'],['cc08beed10704bbc2e518ae8792a85738c5bb142'],8,19,27,1,0.0,1.0,0.0
412e195da29b4f4fc7b72967c192714a6f5eaeb5,Clean up dependencies (no importlib),David Maze,dmaze@diffeo.com,David Maze,dmaze@diffeo.com,2015-06-09 13:30:48-04:00,14400,2015-06-09 13:30:48-04:00,14400,True,False,['setup.py'],['82411dce2eeb37c5785bea9166817a92ac9b9a3e'],4,0,4,1,,,
d7065800e3cf40a9a95be637382324e8f6eedc60,Updated/Added CODEOWNERS with ECCN,svc-scm,48930134+svc-scm@users.noreply.github.com,svc-scm,48930134+svc-scm@users.noreply.github.com,2022-02-12 00:30:37-08:00,28800,2022-02-12 00:30:37-08:00,28800,True,False,['CODEOWNERS'],['412e195da29b4f4fc7b72967c192714a6f5eaeb5'],0,2,2,1,,,
