Hash,Commit Message,Author Name,Author Email,Committor Name,Committor Email,Author Date,Author Timezone,Committor Date,Committor Timezone,in_main_branch,merge,modified_files,parents,deletions,insertions,lines,files,dmm_unit_size,dmm_unit_complexity,dmm_unit_interfacing
8dd57152da443cebb5b1cf784ace6b0c1dba8445,Initial commit,Shareef Dabdoub,shareef@dabdoub.net,Shareef Dabdoub,shareef@dabdoub.net,2016-04-15 13:00:52-04:00,14400,2016-04-15 13:00:52-04:00,14400,True,False,"['.gitignore', 'LICENSE', 'README.md']",[],0,85,85,3,,,
bf6cb2d75e348a5fd14f5cb2e74735f0dc41cecf,Switches the default markdown README file to reStructuredText,Shareef Dabdoub,shareef@dabdoub.net,Shareef Dabdoub,shareef@dabdoub.net,2016-04-28 14:35:40-04:00,14400,2016-04-28 14:35:40-04:00,14400,True,False,['README.rst'],['8dd57152da443cebb5b1cf784ace6b0c1dba8445'],0,0,0,1,,,
898b61abe21f41fe7b04a214b3136e5744c20275,Updates the README with program description and full usage information.,Shareef Dabdoub,shareef@dabdoub.net,Shareef Dabdoub,shareef@dabdoub.net,2016-04-28 14:36:35-04:00,14400,2016-04-28 14:36:35-04:00,14400,True,False,['README.rst'],['bf6cb2d75e348a5fd14f5cb2e74735f0dc41cecf'],2,95,97,1,,,
32250ff1eef2c42653240a126339c1aeeeeb5260,Adds contribution document,Shareef Dabdoub,shareef@dabdoub.net,Shareef Dabdoub,shareef@dabdoub.net,2016-04-28 14:38:17-04:00,14400,2016-04-28 14:38:17-04:00,14400,True,False,['CONTRIBUTING.rst'],['898b61abe21f41fe7b04a214b3136e5744c20275'],0,27,27,1,,,
04c6a8a5c155a88530846c19d39a18757a4fc5f0,First commit of the kraken-biom tool,Shareef Dabdoub,shareef@dabdoub.net,Shareef Dabdoub,shareef@dabdoub.net,2016-04-28 14:39:09-04:00,14400,2016-04-28 14:39:09-04:00,14400,True,False,['kraken-biom.py'],['32250ff1eef2c42653240a126339c1aeeeeb5260'],0,339,339,1,0.11578947368421053,0.5263157894736842,0.7736842105263158
3e8a087931b2a42021b86fad6dade469c0cbe1b8,Adds unit testing framework and testing for the parse_kraken_report method.,Shareef Dabdoub,shareef@dabdoub.net,Shareef Dabdoub,shareef@dabdoub.net,2016-05-03 12:07:12-04:00,14400,2016-05-03 12:07:12-04:00,14400,True,False,"['__init__.py', 'test_parsing.py']",['04c6a8a5c155a88530846c19d39a18757a4fc5f0'],0,312,312,2,0.0946969696969697,1.0,0.9772727272727273
b7e845e29bf0beebe0da7aaa40720957d1114a95,"Adds basic repo files: manifest, setup config, and changelog.",Shareef Dabdoub,shareef@dabdoub.net,Shareef Dabdoub,shareef@dabdoub.net,2016-05-03 12:18:01-04:00,14400,2016-05-03 12:18:01-04:00,14400,True,False,"['CHANGELOG.rst', 'MANIFEST.in', 'setup.cfg']",['3e8a087931b2a42021b86fad6dade469c0cbe1b8'],0,3,3,3,,,
dcf9912bbdce4d5d817d14fff4bbc76c6cc1fc6e,Fixes parsing code so that the min tax level parameter is not ignored.,Shareef Dabdoub,shareef@dabdoub.net,Shareef Dabdoub,shareef@dabdoub.net,2016-05-03 12:20:30-04:00,14400,2016-05-03 12:20:30-04:00,14400,True,False,['kraken-biom.py'],['b7e845e29bf0beebe0da7aaa40720957d1114a95'],1,1,2,1,,,
99dbe951ee48545464d7d7e6ca269b1dd95276ff,Ensures the max and min tax levels are ordered correctly.,Shareef Dabdoub,shareef@dabdoub.net,Shareef Dabdoub,shareef@dabdoub.net,2016-05-03 12:22:15-04:00,14400,2016-05-03 12:22:15-04:00,14400,True,False,['kraken-biom.py'],['dcf9912bbdce4d5d817d14fff4bbc76c6cc1fc6e'],0,4,4,1,0.0,0.0,1.0
2089b122e4ee40f70bac20ac0e692f05935f1d87,Adds Travis CI support.,Shareef Dabdoub,shareef@dabdoub.net,Shareef Dabdoub,shareef@dabdoub.net,2016-05-03 15:24:47-04:00,14400,2016-05-03 15:24:47-04:00,14400,True,False,['.travis.yml'],['99dbe951ee48545464d7d7e6ca269b1dd95276ff'],0,31,31,1,,,
fff3e0977e6c6203e3bdacfc28bbeceaacb91ebe,Tests are now compatible with Python 2.,Shareef Dabdoub,shareef@dabdoub.net,Shareef Dabdoub,shareef@dabdoub.net,2016-05-03 15:34:21-04:00,14400,2016-05-03 15:34:21-04:00,14400,True,False,['test_parsing.py'],['2089b122e4ee40f70bac20ac0e692f05935f1d87'],1,1,2,1,,,
665cbff29ea46f9b9dd16fec3e2ec307a1e561dc,Fix for Python 2 compatibility in verbose output.,Shareef Dabdoub,shareef@dabdoub.net,Shareef Dabdoub,shareef@dabdoub.net,2016-05-03 15:35:23-04:00,14400,2016-05-03 15:35:23-04:00,14400,True,False,['kraken-biom.py'],['fff3e0977e6c6203e3bdacfc28bbeceaacb91ebe'],4,6,10,1,0.0,0.0,1.0
1aec5fc26531b56548c34605eaee395b866295d6,Version bump to 0.1.0,Shareef Dabdoub,shareef@dabdoub.net,Shareef Dabdoub,shareef@dabdoub.net,2016-05-03 15:35:44-04:00,14400,2016-05-03 15:35:44-04:00,14400,True,False,['kraken-biom.py'],['665cbff29ea46f9b9dd16fec3e2ec307a1e561dc'],1,1,2,1,,,
e4eb84a3fa49097a5b366a504e0e0f1f42f79e48,"Fix for travis build, does not need to install self for testing.",Shareef Dabdoub,shareef@dabdoub.net,Shareef Dabdoub,shareef@dabdoub.net,2016-05-03 15:37:43-04:00,14400,2016-05-03 15:37:43-04:00,14400,True,False,['.travis.yml'],['1aec5fc26531b56548c34605eaee395b866295d6'],1,0,1,1,,,
21f7cd70f730db9d226d7528456ed97c506bbda0,Update MANIFEST.in,Shareef Dabdoub,shareef@dabdoub.net,Shareef Dabdoub,shareef@dabdoub.net,2016-05-03 16:01:20-04:00,14400,2016-05-03 16:01:20-04:00,14400,True,False,['MANIFEST.in'],['e4eb84a3fa49097a5b366a504e0e0f1f42f79e48'],1,2,3,1,,,
e781ae56cb75fc41cdaa35c9f79bb8821b4c6ace,Renames kraken-biom.py to kraken_biom.py to comply with standard python naming conventions.,Shareef Dabdoub,shareef@dabdoub.net,Shareef Dabdoub,shareef@dabdoub.net,2016-05-04 14:51:35-04:00,14400,2016-05-04 14:51:35-04:00,14400,True,False,"['kraken_biom.py', 'test_parsing.py']",['21f7cd70f730db9d226d7528456ed97c506bbda0'],2,2,4,2,,,
5f38a6b13d67b417a62cb16d0c1ed678ec8874ab,Adds Installation and Requirements sections to README.,Shareef Dabdoub,shareef@dabdoub.net,Shareef Dabdoub,shareef@dabdoub.net,2016-05-04 14:52:38-04:00,14400,2016-05-04 14:52:38-04:00,14400,True,False,['README.rst'],['e781ae56cb75fc41cdaa35c9f79bb8821b4c6ace'],0,18,18,1,,,
4f61f80a9241961ee4df851daceb136949ae79f1,Adds Travis CI badge to README.,Shareef Dabdoub,shareef@dabdoub.net,Shareef Dabdoub,shareef@dabdoub.net,2016-05-04 14:52:55-04:00,14400,2016-05-04 14:52:55-04:00,14400,True,False,['README.rst'],['5f38a6b13d67b417a62cb16d0c1ed678ec8874ab'],0,3,3,1,,,
306740ef490b281d1d157b5c6277650f984ef988,Adds fully-functional setup.py to repository.,Shareef Dabdoub,shareef@dabdoub.net,Shareef Dabdoub,shareef@dabdoub.net,2016-05-04 14:54:03-04:00,14400,2016-05-04 14:54:03-04:00,14400,True,False,['setup.py'],['4f61f80a9241961ee4df851daceb136949ae79f1'],0,54,54,1,1.0,1.0,1.0
d6ec981917fb8e54153531f4ec4502487e36dd5e,"Replaces [wheel] with [bdist_wheel] in setup.cfg.

The bdist_wheel directive is the current official directive as per the
python packaging docs: https://python-packaging-user-guide.readthedocs.io/en/latest/distributing/#universal-wheels.
The [wheel] directive was the original according to https://github.com/meshy/pythonwheels/issues/71.",Shareef Dabdoub,shareef@dabdoub.net,Shareef Dabdoub,shareef@dabdoub.net,2016-05-04 15:10:48-04:00,14400,2016-05-04 15:10:48-04:00,14400,True,False,['setup.cfg'],['306740ef490b281d1d157b5c6277650f984ef988'],1,4,5,1,,,
8aceb8d5d98f5359121ec122a74915da814c228d,Renames _main() to main and updates the entry_points in setup.py.,Shareef Dabdoub,shareef@dabdoub.net,Shareef Dabdoub,shareef@dabdoub.net,2016-05-12 14:46:40-04:00,14400,2016-05-12 14:46:40-04:00,14400,True,False,"['kraken_biom.py', 'setup.py']",['d6ec981917fb8e54153531f4ec4502487e36dd5e'],3,3,6,2,,,
6e0b37f553652982c7307a5c45624a195e897bf5,Moves the central loop for processing kraken-report files from main() to a self-contained method.,Shareef Dabdoub,shareef@dabdoub.net,Shareef Dabdoub,shareef@dabdoub.net,2016-05-12 15:04:42-04:00,14400,2016-05-12 15:04:42-04:00,14400,True,False,['kraken_biom.py'],['8aceb8d5d98f5359121ec122a74915da814c228d'],25,34,59,1,0.0,1.0,1.0
dcaff194c9c3a6b649cf01ae5216bd5ed7930d4c,Adds parameter descriptions to doctoring for write_biom.,Shareef Dabdoub,shareef@dabdoub.net,Shareef Dabdoub,shareef@dabdoub.net,2016-05-24 13:39:51-04:00,14400,2016-05-24 13:39:51-04:00,14400,True,False,['kraken_biom.py'],['6e0b37f553652982c7307a5c45624a195e897bf5'],0,9,9,1,,,
a44955f953b4355937b5e6f6e515a2e432aabc62,Adds a program argument that enables writing a file containing just the OTU IDs from the data set.,Shareef Dabdoub,shareef@dabdoub.net,Shareef Dabdoub,shareef@dabdoub.net,2016-05-24 13:40:49-04:00,14400,2016-05-24 13:40:49-04:00,14400,True,False,['kraken_biom.py'],['dcaff194c9c3a6b649cf01ae5216bd5ed7930d4c'],0,32,32,1,0.3333333333333333,0.0,1.0
6b739a2b4e913a840953fca38ad30cbe6fa84e53,"When creating taxa strings, add empty levels after last level to fill the string out to species.

For example, for a family-level OTU, add [""g__"", ""s__""] to the end.",Shareef Dabdoub,shareef@dabdoub.net,Shareef Dabdoub,shareef@dabdoub.net,2016-06-01 17:14:57-04:00,14400,2016-06-01 17:14:57-04:00,14400,True,False,['kraken_biom.py'],['a44955f953b4355937b5e6f6e515a2e432aabc62'],1,5,6,1,1.0,0.0,1.0
23a6070c48fc2d96232a9f90627879b69874382d,Pass max and min rank to process_samples(),Shareef Dabdoub,shareef@dabdoub.net,Shareef Dabdoub,shareef@dabdoub.net,2016-06-01 17:16:13-04:00,14400,2016-06-01 17:16:13-04:00,14400,True,False,['kraken_biom.py'],['6b739a2b4e913a840953fca38ad30cbe6fa84e53'],4,6,10,1,0.0,0.0,0.0
393d5a2509c0b35e67dc28200db98d30b02cddf3,"Update test_parse_kraken_report_taxonomy() to reflect changes in tax_fmt().

tax_fmt() now fills out taxonomy strings so that everything from k__ to s__ is included, even if those levels are blank.",Shareef Dabdoub,shareef@dabdoub.net,Shareef Dabdoub,shareef@dabdoub.net,2016-06-01 17:18:08-04:00,14400,2016-06-01 17:18:08-04:00,14400,True,False,['test_parsing.py'],['23a6070c48fc2d96232a9f90627879b69874382d'],4,19,23,1,0.0,1.0,1.0
0af48d94a1f6cf1eab6cada97488c5d14899084e,Add tests for the biom_create() method.,Shareef Dabdoub,shareef@dabdoub.net,Shareef Dabdoub,shareef@dabdoub.net,2016-06-01 17:18:32-04:00,14400,2016-06-01 17:18:32-04:00,14400,True,False,['test_biom_create.py'],['393d5a2509c0b35e67dc28200db98d30b02cddf3'],0,232,232,1,0.15025906735751296,1.0,1.0
5ee7e770e75b01a55c2017670d1e3278dba8a249,Add test stub for process_samples() method.,Shareef Dabdoub,shareef@dabdoub.net,Shareef Dabdoub,shareef@dabdoub.net,2016-06-01 17:18:53-04:00,14400,2016-06-01 17:18:53-04:00,14400,True,False,['test_process_samples.py'],['0af48d94a1f6cf1eab6cada97488c5d14899084e'],0,196,196,1,0.024390243902439025,1.0,1.0
4f27bc808dbf6cb04fba47564122a7c0fab3a055,Change assertTrue to assertEqual.,Shareef Dabdoub,shareef@dabdoub.net,Shareef Dabdoub,shareef@dabdoub.net,2016-06-02 11:54:11-04:00,14400,2016-06-02 11:54:11-04:00,14400,True,False,['test_biom_create.py'],['5ee7e770e75b01a55c2017670d1e3278dba8a249'],6,6,12,1,,,
3e93498c3da36ef605db15c08bc2f47f9a079be9,"Add tests to test_process_samples.

Validates sample IDs from file names and per-sample OTU counts.",Shareef Dabdoub,shareef@dabdoub.net,Shareef Dabdoub,shareef@dabdoub.net,2016-06-02 11:55:12-04:00,14400,2016-06-02 11:55:12-04:00,14400,True,False,['test_process_samples.py'],['4f27bc808dbf6cb04fba47564122a7c0fab3a055'],15,96,111,1,0.01282051282051282,1.0,1.0
f070c40cd3e18453f1cf43fdaeef14107983358e,Add test to test_process_samples validating parsing for a subset of the taxa from the test data.,Shareef Dabdoub,shareef@dabdoub.net,Shareef Dabdoub,shareef@dabdoub.net,2016-06-02 12:02:50-04:00,14400,2016-06-02 12:02:50-04:00,14400,True,False,['test_process_samples.py'],['3e93498c3da36ef605db15c08bc2f47f9a079be9'],0,30,30,1,0.0,1.0,1.0
a0e6cf85e54053a18ce334d7ac7f49ac03a1d2ef,"Remove python 2.7 from the travis config.

There is an unknown issue in test_process_samples.py with writing
the kraken results to a temp file under python 2.7 that causes the parsing
method to fail. The same method is fine when run in test_parsing.py and
test_biom_create.py under python 2.7. So until I can figure out where the
problem is, I'm removing python 2.7 from the travis config.",Shareef Dabdoub,shareef@dabdoub.net,Shareef Dabdoub,shareef@dabdoub.net,2016-06-02 15:14:28-04:00,14400,2016-06-02 15:14:28-04:00,14400,True,False,['.travis.yml'],['f070c40cd3e18453f1cf43fdaeef14107983358e'],1,0,1,1,,,
dea74216ea1b00a9d0a810ebe4ab81f46dae236e,"Fix write_otu_file so the file is opened for writing, not reading. Handle file path with no dir specified.",Shareef Dabdoub,shareef@dabdoub.net,Shareef Dabdoub,shareef@dabdoub.net,2016-06-02 15:17:36-04:00,14400,2016-06-02 15:17:36-04:00,14400,True,False,['kraken_biom.py'],['a0e6cf85e54053a18ce334d7ac7f49ac03a1d2ef'],2,3,5,1,,,
b7db8857ef9feba63945a0c494b1f85c9ed925bf,"Adds description of the taxonomy metadata.

The README now contains a paragraph mentioning that kraken-biom stores the taxonomy for each OTU in the standard QIIME format, and that other formats may be supported in the future.",Shareef Dabdoub,shareef@dabdoub.net,Shareef Dabdoub,shareef@dabdoub.net,2016-08-31 12:09:10-04:00,14400,2016-08-31 12:09:10-04:00,14400,True,False,['README.rst'],['dea74216ea1b00a9d0a810ebe4ab81f46dae236e'],0,5,5,1,,,
62e25a41108e291d233d301cf11eabe90585c971,Corrected version number in kraken-biom.py,Shareef Dabdoub,shareef@dabdoub.net,Shareef Dabdoub,shareef@dabdoub.net,2016-08-31 12:32:38-04:00,14400,2016-08-31 12:32:38-04:00,14400,True,False,['kraken_biom.py'],['b7db8857ef9feba63945a0c494b1f85c9ed925bf'],1,1,2,1,,,
ee6896065f80c7152abfcb595135e469adac5885,"Expanded installation instructions

The README file now includes instructions for installing with pip (kraken-biom now on PyPI) from PyPI and with pip directly from GitHub.",Shareef Dabdoub,shareef@dabdoub.net,Shareef Dabdoub,shareef@dabdoub.net,2016-08-31 14:01:59-04:00,14400,2016-08-31 14:01:59-04:00,14400,True,False,['README.rst'],['62e25a41108e291d233d301cf11eabe90585c971'],0,12,12,1,,,
c3b54a029e5beaffbb39f17409101c546366f1c7,"Updates conda setup.

The conda setup was updated with recommendations for Travis from Conda: http://conda.pydata.org/docs/travis.html",Shareef Dabdoub,shareef@dabdoub.net,Shareef Dabdoub,shareef@dabdoub.net,2016-08-31 14:02:53-04:00,14400,2016-08-31 14:02:53-04:00,14400,True,False,['.travis.yml'],['ee6896065f80c7152abfcb595135e469adac5885'],3,12,15,1,,,
42fa460d87948fee8fb15cc3acdb00e284938469,"add failing test assertions for taxonomy parsing

Add extra classifications to the test data to trigger a failure for the
taxonomy parsing code (specifically when classifications have missing
ranks).",Jesse Connell,ancon@upenn.edu,Jesse Connell,ancon@upenn.edu,2017-09-25 12:02:05-04:00,14400,2017-09-25 12:02:05-04:00,14400,True,False,['test_parsing.py'],['c3b54a029e5beaffbb39f17409101c546366f1c7'],7,25,32,1,0.0,1.0,1.0
c1ac6095dafe1afb4ac6942c125529c5198b08f0,"Fix #4: parse taxonomic level from indentation

Switch to parsing kraken-report's taxonomic hierarchy from the
indentation level of each entry's scientific name (instead of from the
named rank for a given entry).  This should handle entries with missing
named ranks.",Jesse Connell,ancon@upenn.edu,Jesse Connell,ancon@upenn.edu,2017-09-25 12:14:15-04:00,14400,2017-09-25 12:14:15-04:00,14400,True,False,['kraken_biom.py'],['42fa460d87948fee8fb15cc3acdb00e284938469'],11,30,41,1,1.0,1.0,1.0
d90f56e6f02060b3fc9ac1ac06c2d35b31fb62fe,updated to take folder of kraken reports,Erik,ecl@mail.med.upenn.edu,Erik,ecl@mail.med.upenn.edu,2018-02-19 14:37:33-05:00,18000,2018-02-19 14:37:33-05:00,18000,True,False,['kraken_biom.py'],['c3b54a029e5beaffbb39f17409101c546366f1c7'],2,9,11,1,0.0,0.4,1.0
9a8c870d27076524a9c710a461b6ed47ae746f06,Update kraken_biom.py,Erik Clarke,eclarke@users.noreply.github.com,GitHub,noreply@github.com,2018-03-16 10:13:45-04:00,14400,2018-03-16 10:13:45-04:00,14400,True,False,['kraken_biom.py'],['d90f56e6f02060b3fc9ac1ac06c2d35b31fb62fe'],1,1,2,1,,,
e7b93c91cc8dae7b04f9cab1dbf997dc6d38ff87,"Only keep one taxonomic rank

Allows to only export a single taxonomic rank",Maxime Borry,maxibor@users.noreply.github.com,GitHub,noreply@github.com,2018-04-03 16:39:54+02:00,-7200,2018-04-03 16:39:54+02:00,-7200,True,False,['kraken_biom.py'],['c3b54a029e5beaffbb39f17409101c546366f1c7'],1,1,2,1,,,
5cd8acea4b742447a2d315aeeba74646cc7c6c4f,Removed 3.3 (due to adding pathlib) from the test list and added 3.6,Shareef Dabdoub,shareef@dabdoub.net,Shareef Dabdoub,shareef@dabdoub.net,2018-04-05 16:01:47-04:00,14400,2018-04-05 16:01:47-04:00,14400,True,False,['.travis.yml'],['15b8df9b563836a5da5f002c86f1f0a14a72b9ac'],1,1,2,1,,,
46b32df9b3eb478216afc38cd1dd207492ac6c29,"Updates program documentation to reflect executable change

Instead of running kraken-biom.py, the setup.py installs the program with no extension: kraken-biom",Shareef Dabdoub,shareef@dabdoub.net,Shareef Dabdoub,shareef@dabdoub.net,2018-08-02 14:56:00-04:00,14400,2018-08-02 14:56:00-04:00,14400,True,False,"['README.rst', 'kraken_biom.py']",['1328008bf36ddae94a4e295def3ca944debcbeb4'],9,9,18,2,,,
8ffc5f997dff347797496feda02d76a812825a05,Add metadata to the biom file if not given. Else use the tsv file supplied by te user to add metadata to the samples. This way metadata can be uses for other analyses.,casper,casperprins98@gmail.com,casper,casperprins98@gmail.com,2019-03-07 21:48:50+01:00,-3600,2019-03-07 21:48:50+01:00,-3600,True,False,"['README.rst', 'kraken_biom.py']",['46b32df9b3eb478216afc38cd1dd207492ac6c29'],6,48,54,2,0.1875,0.6875,0.1875
50c049b52abbccbaa1a70fbbd13aa91a1d18c11d,"Added tests for metadata.
Bumped version number to 1.1.1

New function that reads the given metadata or
makes dummy metadata is no metadata is available.

Added the metadata command to README",casper,casperprins98@gmail.com,casper,casperprins98@gmail.com,2019-03-08 20:52:55+01:00,-3600,2019-03-08 20:52:55+01:00,-3600,True,False,"['README.rst', 'kraken_biom.py', 'test_biom_create.py']",['8ffc5f997dff347797496feda02d76a812825a05'],31,79,110,3,0.6956521739130435,1.0,1.0
e59656a261887b787029c6c3ee5a046ad7097359,add dockerfile to install options,Shaun Chuah,chershiong@gmail.com,Shaun Chuah,chershiong@gmail.com,2021-09-15 11:57:11+01:00,-3600,2021-09-15 11:57:11+01:00,-3600,True,False,"['Dockerfile', 'README.rst']",['46b32df9b3eb478216afc38cd1dd207492ac6c29'],0,19,19,2,,,
e37d890417c23c9de97513103db0c7ab3c2cdc6f,"Adds support for subspecies/strains as a level in the output table.

SS (subspecies/strain) is now an option for output level.",Shareef Dabdoub,shareef@dabdoub.net,Shareef Dabdoub,shareef@dabdoub.net,2021-09-15 14:14:11-04:00,14400,2021-09-15 14:14:11-04:00,14400,True,False,['kraken_biom.py'],['75678699f3abb2aa34e09a84fd21e66dd4e882be'],18,17,35,1,0.6,0.0,0.6
a9e6799ad947741d003f0fa9204b59982a3a83b5,Minor wording changes to comments and help.,Shareef Dabdoub,shareef@dabdoub.net,Shareef Dabdoub,shareef@dabdoub.net,2021-09-15 14:14:33-04:00,14400,2021-09-15 14:14:33-04:00,14400,True,False,['kraken_biom.py'],['e37d890417c23c9de97513103db0c7ab3c2cdc6f'],10,9,19,1,1.0,0.0,0.0
58dd2ff64712aed748dd719670e68c2434706ca0,Updates program version to 1.2.0,Shareef Dabdoub,shareef@dabdoub.net,Shareef Dabdoub,shareef@dabdoub.net,2021-09-15 14:14:51-04:00,14400,2021-09-15 14:14:51-04:00,14400,True,False,['kraken_biom.py'],['a9e6799ad947741d003f0fa9204b59982a3a83b5'],1,1,2,1,,,
2689d7d67c61d534841b04cd34da4bf0954739d8,Update README.rst,Shareef Dabdoub,shareef@dabdoub.net,GitHub,noreply@github.com,2022-03-22 00:45:53-04:00,14400,2022-03-22 00:45:53-04:00,14400,True,False,['README.rst'],['58dd2ff64712aed748dd719670e68c2434706ca0'],0,7,7,1,,,
