Hash,Commit Message,Author Name,Author Email,Committor Name,Committor Email,Author Date,Author Timezone,Committor Date,Committor Timezone,in_main_branch,merge,modified_files,parents,deletions,insertions,lines,files,dmm_unit_size,dmm_unit_complexity,dmm_unit_interfacing
1a91ac63daa55ffff8f3ad52795b89f937158fae,initial commit,Yehuda Chikvashvili,yehudaac1@gmail.com,Yehuda Chikvashvili,yehudaac1@gmail.com,2018-03-26 17:25:30+03:00,-10800,2018-03-26 17:25:30+03:00,-10800,True,False,"['.gitignore', 'README.md', 'discovery.py', '__init__.py', 'dashboard.py', 'hunter.py', 'kubelet.py', 'proxy.py', 'kube-hunter.py', 'requests.txt', 'services.py', 'validation.py']",[],0,459,459,12,1.0,0.9411764705882353,0.8280542986425339
c8c8cd9ebdcafe100901f7990ecc7d35054f24eb,"Fixed failed tries to scan unimplemented services
Added an empty url to dashboard hunter
Added chrome binary to automatically be install",daniel_sagi,daniel.sagi@aquasec.com,daniel_sagi,daniel.sagi@aquasec.com,2018-04-23 20:06:10+03:00,-10800,2018-04-23 20:06:20+03:00,-10800,True,False,"['dashboard.py', 'kube-hunter.py', 'requests.txt', 'requirements.txt']",['1a91ac63daa55ffff8f3ad52795b89f937158fae'],9,15,24,4,0.0,1.0,1.0
cd880ec50ee4304b24064800ce4e44c873a1b887,Delete everything of Kube Hunter 1.0,Shir,shirtam7@gmail.com,Shir,shirtam7@gmail.com,2018-05-06 19:50:00+03:00,-10800,2018-05-06 19:50:00+03:00,-10800,True,False,"['README.md', 'discovery.py', '__init__.py', 'dashboard.py', 'hunter.py', 'kubelet.py', 'proxy.py', 'kube-hunter.py', 'requirements.txt', 'services.py', 'validation.py']",['c8c8cd9ebdcafe100901f7990ecc7d35054f24eb'],462,0,462,11,0.0752212389380531,0.05752212389380531,0.168141592920354
eb6cbc263608b1203534cb27de7614d703d9ff12,Initial Commit,Shir,shirtam7@gmail.com,Shir,shirtam7@gmail.com,2018-05-06 19:51:36+03:00,-10800,2018-05-06 19:51:36+03:00,-10800,True,False,"['.gitignore', '__init__.py', 'events.py', 'host_discovery.py', 'kube_open_dashboard.py', 'main.py', '__init__.py', '__init__.cpython-36.pyc', 'host_discovery.cpython-36.pyc', 'kube_open_dashboard.cpython-36.pyc', 'port_discovery.cpython-36.pyc', 'host_discovery.py', 'kube_open_dashboard.py', 'port_discovery.py', 'port_discovery.py']",['cd880ec50ee4304b24064800ce4e44c873a1b887'],3,200,203,15,1.0,1.0,1.0
6acf1beec88cc286d9e4ad5c741d779a10a8abfc,"changed function describe_service_type in services, to use a dictionary",daniel_sagi,daniel.sagi@aquasec.com,daniel_sagi,daniel.sagi@aquasec.com,2018-05-08 10:07:51+03:00,-10800,2018-05-08 10:07:51+03:00,-10800,True,False,['services.py'],['c8c8cd9ebdcafe100901f7990ecc7d35054f24eb'],13,7,20,1,0.0,0.0,0.0
48e1307f1d7c9bd404f68aba21a5a4d0edbd8686,"Added EventQueue class, to handle events.
Events now gets processed asynchronously.",daniel_sagi,daniel.sagi@aquasec.com,daniel_sagi,daniel.sagi@aquasec.com,2018-05-10 14:15:12+03:00,-10800,2018-05-10 14:25:29+03:00,-10800,True,False,"['__init__.py', 'events.py', 'events.pyc', 'host_discovery.py', 'kube-hunter.py', 'kube_open_dashboard.py', 'main.py', '__init__.pyc', 'host_discovery.py', 'host_discovery.pyc', 'kube_open_dashboard.py', 'kube_open_dashboard.pyc', 'port_discovery.py', 'port_discovery.pyc', 'port_discovery.py', 'requirements.txt']",['eb6cbc263608b1203534cb27de7614d703d9ff12'],116,70,186,16,0.0,0.0,0.0
beb50d40bce41bec52ac7db27065111868f32e36,"Added .gitignore file, ignoring .pyc files,
Also changed modules structure",daniel_sagi,daniel.sagi@aquasec.com,daniel_sagi,daniel.sagi@aquasec.com,2018-05-10 19:02:07+03:00,-10800,2018-05-13 17:16:51+03:00,-10800,True,False,"['.gitignore', '__init__.py', 'dashboard.py', 'hosts.py', 'ports.py', 'events.py', 'events.pyc', '__init__.py', 'dashboard.py', 'kube-hunter.py', '__init__.py', '__init__.pyc', '__init__.cpython-36.pyc', 'host_discovery.cpython-36.pyc', 'kube_open_dashboard.cpython-36.pyc', 'port_discovery.cpython-36.pyc', 'host_discovery.pyc', 'kube_open_dashboard.py', 'kube_open_dashboard.pyc', 'port_discovery.pyc']",['48e1307f1d7c9bd404f68aba21a5a4d0edbd8686'],42,62,104,20,1.0,1.0,1.0
c735b5df95509f88226de9c148354c58d00aeab1,"Started adding KubeProxy hunting, basic services detection mechanism was added.
The idea is discovering sub paths of resources in the api and sending them for hunting.

Added Dashboard detection from Proxy.
Also improved architecture of discovery/hunting from a ""secure"" perspective",daniel_sagi,daniel.sagi@aquasec.com,daniel_sagi,daniel.sagi@aquasec.com,2018-05-13 17:02:39+03:00,-10800,2018-05-15 12:35:36+03:00,-10800,True,False,"['__init__.py', 'dashboard.py', 'proxy.py', '__init__.py', 'dashboard.py', 'proxy.py', 'requirements.txt']",['beb50d40bce41bec52ac7db27065111868f32e36'],24,92,116,7,1.0,1.0,1.0
376519614058ee073c2135e155860ed2dd08c056,"Changed events architecture, using class objects for all events
Added new subscription method for events, using a ""subscribe"" decorator.
Added an optional predicate function to events, for optional filtering on triggered time. used mainly for OpenPortEvent.
Added proper logging and argparse
Added cleanup of threads when exiting/finishing",daniel_sagi,daniel.sagi@aquasec.com,daniel_sagi,daniel.sagi@aquasec.com,2018-05-14 17:13:13+03:00,-10800,2018-05-15 13:03:47+03:00,-10800,True,False,"['dashboard.py', 'hosts.py', 'ports.py', 'proxy.py', 'events.py', 'dashboard.py', 'proxy.py', 'kube-hunter.py', 'log.py']",['c735b5df95509f88226de9c148354c58d00aeab1'],69,124,193,9,1.0,1.0,0.6060606060606061
672c59f576a08774d26ff18238c4c17d3b2432a4,"Added events/ folder.
Added dynamic imports for all modules inside: 'events/',  'discovery/', 'hunting/' (you can now add new files with new implementations, and not worry about imports.)
Changed port timeout to be 1.5 seconds, more reliable results.
Changed default log level to INFO",daniel_sagi,daniel.sagi@aquasec.com,daniel_sagi,daniel.sagi@aquasec.com,2018-05-15 15:57:36+03:00,-10800,2018-05-15 15:57:42+03:00,-10800,True,False,"['__init__.py', 'ports.py', 'proxy.py', '__init__.py', 'default_types.py', 'handler.py', '__init__.py', 'proxy.py', 'kube-hunter.py', 'log.py']",['376519614058ee073c2135e155860ed2dd08c056'],61,76,137,10,0.0,0.0,0.0
290f87de70c7806033cf382af9a9ca5fa03e1297,"1. added log/
2. Started adding kubelet scanning.
3. Changed events architecture. All events are inheriting from ""Event"" class. when instantiating and defining a new event class, attributes other than what is important for that perticular event are not needed. the event handler will be stacking the events, so that each event will have all the attributes of its successors.
This proccess is invisible to the developer, but needs to be acknowledged.
*note: from now on, all executors needs to set self.event to given arg on init*
Example (pseudo):

@subscribe(NewHostEvent)
def PortScan(event):
		publish(OpenPortEvent(port=""8080""))

@subscribe(OpenPortEvent)
def print(event):
		print(event.host)

publish(NewHostEvent(host=""0.0.0.0""))
>> output: 0.0.0.0

the print function recieves an open port event. even though when publishing the OpenPortEvent we did not specify a host, the print function can access the ""host"" attribute, as the OpenPortEvent successor was NewHostEvent. if ""host"" was not defined on the succesors, it is ""None""",daniel_sagi,daniel.sagi@aquasec.com,daniel_sagi,daniel.sagi@aquasec.com,2018-05-24 15:25:43+03:00,-10800,2018-05-24 15:39:31+03:00,-10800,True,False,"['dashboard.py', 'hosts.py', 'kubelet.py', 'ports.py', 'proxy.py', 'default_types.py', 'handler.py', 'dashboard.py', 'kubelet.py', 'proxy.py', 'kube-hunter.py', '__init__.py', 'config.py']",['672c59f576a08774d26ff18238c4c17d3b2432a4'],74,176,250,13,1.0,0.6326530612244898,1.0
a465c3f2ebb9150846c500322157135751bf37dd,"1. Changed order of modules and pacakges in directories.
2. Changed method of hidden stacking of event, to send self as an argument, by inheriting from ""Hunter"" class. where the publish acts as a proxy to the handler.
3. Added new way of categorizing events, while added an option to subscribe to a father event. if en event gets publish, if its father event is hooked, the hook will be triggered
4. Added a reporter in log/ which listens to parent events, meanwhile Vulnerability and OpenService were added. all logging will be made from reporter from now on",daniel_sagi,daniel.sagi@aquasec.com,daniel_sagi,daniel.sagi@aquasec.com,2018-05-27 17:45:20+03:00,-10800,2018-05-27 17:45:34+03:00,-10800,True,False,"['kubelet.py', 'kube-hunter.py', '__init__.py', 'reporter.py', '__init__.py', '__init__.py', 'dashboard.py', 'hosts.py', 'kubelet.py', 'ports.py', 'proxy.py', '__init__.py', 'handler.py', '__init__.py', 'common.py', 'information.py', '__init__.py', 'dashboard.py', 'kubelet.py', 'proxy.py', '__init__.py', 'defaults.py']",['69dba8f1c7eee54000341319229070ecd36bbbcd'],85,210,295,22,1.0,1.0,0.4772727272727273
9e8dfbc34ed56250aab0277afc99fbcc76feea68,added hunting for open debug handlers on the kubelet,daniel_sagi,daniel.sagi@aquasec.com,daniel_sagi,daniel.sagi@aquasec.com,2018-05-28 19:37:30+03:00,-10800,2018-05-28 19:37:30+03:00,-10800,True,False,"['information.py', 'kubelet.py']",['a465c3f2ebb9150846c500322157135751bf37dd'],35,130,165,2,1.0,1.0,1.0
4a98d698a17d9adcf987a31f703f9468f3e5ca66,"1. Added --pod flag to option ""from pod"" hunting. this will hunt the internal subnet of the cluster.
2. Added service account token and certificate handling, when running as a pod, to try and access resources that are ""secured""
3. Added anonymous auth vulnerability detection
4. Changed requirements.txt for compatibility",daniel_sagi,daniel.sagi@aquasec.com,daniel_sagi,daniel.sagi@aquasec.com,2018-06-06 10:07:57+03:00,-10800,2018-06-06 10:08:02+03:00,-10800,True,False,"['.dockerignore', 'Dockerfile', 'kube-hunter.py', '__init__.py', 'config.py', 'reporter.py', 'hosts.py', 'kubelet.py', 'ports.py', 'handler.py', 'common.py', 'information.py', 'dashboard.py', 'kubelet.py', 'proxy.py', 'requirements.txt']",['9e8dfbc34ed56250aab0277afc99fbcc76feea68'],132,250,382,16,1.0,0.8395061728395061,0.7901234567901234
36e87807e6d5dbede573efe38fcd8f17efa7c9da,"1. completely transferred all event types to their corresponding module
2. started working on results table.
3. *added convention* from now on, every vulnerability/service event, should have a __doc__ that describes them. notice the new get_name(), component, and explain() attributes that needs to be implemented as well.",daniel_sagi,daniel.sagi@aquasec.com,daniel_sagi,daniel.sagi@aquasec.com,2018-06-10 16:27:37+03:00,-10800,2018-06-10 16:43:05+03:00,-10800,True,False,"['kube-hunter.py', 'reporter.py', 'dashboard.py', 'hosts.py', 'kubelet.py', 'proxy.py', 'handler.py', '__init__.py', 'common.py', 'information.py', 'dashboard.py', 'kubelet.py', 'proxy.py', 'requirements.txt']",['4a98d698a17d9adcf987a31f703f9468f3e5ca66'],143,335,478,14,0.8173076923076923,0.9134615384615384,1.0
faa7571127c4df8bee988ebf323861c451454046,"1. Added an --active flag, to allow optional ""Proof"" result, which will do an active hunting of a found vulnerability
2. Added a --remote flag to specify remote clusters/machines for hunting.
3. Improved a bit of the architecture, (Services)

Note:
The reporter module, will gather vulnerabilities before their active hunting will start.
This is not an issue, as we can access all of the attributes of the event directly from the active hunter (event.previous), which we will proccess on the end in the report",daniel_sagi,daniel.sagi@aquasec.com,daniel_sagi,daniel.sagi@aquasec.com,2018-06-10 19:34:07+03:00,-10800,2018-06-10 19:34:12+03:00,-10800,True,False,"['kube-hunter.py', 'reporter.py', 'dashboard.py', 'hosts.py', 'kubelet.py', 'proxy.py', 'common.py', 'kubelet.py', 'proxy.py']",['36e87807e6d5dbede573efe38fcd8f17efa7c9da'],47,73,120,9,1.0,1.0,0.9333333333333333
1934d21c99c4071a4d1c45c7c73d8e1409f03a92,changed metavar on remote flag,daniel_sagi,daniel.sagi@aquasec.com,daniel_sagi,daniel.sagi@aquasec.com,2018-06-10 19:48:34+03:00,-10800,2018-06-10 19:48:34+03:00,-10800,True,False,['kube-hunter.py'],['faa7571127c4df8bee988ebf323861c451454046'],1,1,2,1,,,
a2e37927bdfe977061beed86af246d48cbaebc1b,"changed directory tree of all modules and packages, for easing on future implementations and extensions",daniel_sagi,daniel.sagi@aquasec.com,daniel_sagi,daniel.sagi@aquasec.com,2018-06-10 20:09:09+03:00,-10800,2018-06-10 20:09:09+03:00,-10800,True,False,"['kube-hunter.py', 'reporter.py', '__init__.py', '__init__.py', '__init__.py', '__init__.py', 'handler.py', '__init__.py', 'common.py', '__init__.py', 'defaults.py', '__init__.py', '__init__.py', 'dashboard.py', 'hosts.py', 'kubelet.py', 'ports.py', 'proxy.py', '__init__.py', 'dashboard.py', 'kubelet.py', 'proxy.py']",['1934d21c99c4071a4d1c45c7c73d8e1409f03a92'],35,37,72,22,,,
70ea40367b3d46781156b25b5eedcd02a82d17ce,fixed bug: empty remote option,daniel_sagi,daniel.sagi@aquasec.com,daniel_sagi,daniel.sagi@aquasec.com,2018-06-10 20:10:26+03:00,-10800,2018-06-10 20:10:26+03:00,-10800,True,False,['kube-hunter.py'],['a2e37927bdfe977061beed86af246d48cbaebc1b'],1,1,2,1,,,
01c4aac1054c9a51c7b973f0503b78ac779adabb,"Active hunting is now available by inheriting from ActiveHunter. the hunter wil subscribe only if the --active flag was set.

1. Removed scanning configuration from events, from now on, scanning config is accessed from the main module
2. Moved core types to a ""toplevel"" file",daniel_sagi,daniel.sagi@aquasec.com,daniel_sagi,daniel.sagi@aquasec.com,2018-06-11 12:34:34+03:00,-10800,2018-06-11 12:39:11+03:00,-10800,True,False,"['kube-hunter.py', 'reporter.py', '__init__.py', 'handler.py', 'types.py', '__init__.py', 'defaults.py', 'hosts.py', 'kubelet.py']",['70ea40367b3d46781156b25b5eedcd02a82d17ce'],37,46,83,9,1.0,1.0,0.0
75393da91af8c2aa335d53507b26562727e24751,simplified kubelet open handlers hunting and types,daniel_sagi,daniel.sagi@aquasec.com,daniel_sagi,daniel.sagi@aquasec.com,2018-06-11 14:26:09+03:00,-10800,2018-06-11 14:26:09+03:00,-10800,True,False,"['reporter.py', 'handler.py', 'kubelet.py', 'kubelet.py']",['01c4aac1054c9a51c7b973f0503b78ac779adabb'],127,74,201,4,1.0,0.0,0.0
838be659673a1362baaf2391522184572cf7f7f1,"Added proves for vulnerabilities, added 'evidence' field for every vulnerability to be filled be provers(mostly ActiveHunters)",daniel_sagi,daniel.sagi@aquasec.com,daniel_sagi,daniel.sagi@aquasec.com,2018-06-11 18:01:54+03:00,-10800,2018-06-11 18:01:54+03:00,-10800,True,False,"['reporter.py', 'database.py', 'handler.py', 'common.py', 'kubelet.py', 'proxy.py']",['75393da91af8c2aa335d53507b26562727e24751'],29,132,161,6,0.5352112676056338,0.352112676056338,0.8591549295774648
9bb835edd399a15a67cca89fb4faeb0ba2a86818,added azure spn subscription hunting,daniel_sagi,daniel.sagi@aquasec.com,daniel_sagi,daniel.sagi@aquasec.com,2018-06-11 18:26:58+03:00,-10800,2018-06-11 18:26:58+03:00,-10800,True,False,['aks.py'],['838be659673a1362baaf2391522184572cf7f7f1'],0,64,64,1,1.0,1.0,0.7777777777777778
548ae7e486c265ead9739eef121ec4a18c5ccf69,"changed evidence of priviledged containers, also added casting to str in reporter",daniel_sagi,daniel.sagi@aquasec.com,daniel_sagi,daniel.sagi@aquasec.com,2018-06-11 18:28:01+03:00,-10800,2018-06-11 18:28:01+03:00,-10800,True,False,"['reporter.py', 'kubelet.py']",['9bb835edd399a15a67cca89fb4faeb0ba2a86818'],2,3,5,2,1.0,1.0,1.0
7e939b454464582d986015e5563a9e04be8dfbc1,finished aks spn hunting,daniel_sagi,daniel.sagi@aquasec.com,daniel_sagi,daniel.sagi@aquasec.com,2018-06-11 18:44:54+03:00,-10800,2018-06-11 18:44:54+03:00,-10800,True,False,['aks.py'],['548ae7e486c265ead9739eef121ec4a18c5ccf69'],3,10,13,1,1.0,1.0,1.0
973c2a25a0f54a07c498dbc4a5bbb8fb2e3fadca,"changed output results table format, added AzureMetadata vulnerability on discovery",daniel_sagi,daniel.sagi@aquasec.com,daniel_sagi,daniel.sagi@aquasec.com,2018-06-11 20:02:25+03:00,-10800,2018-06-11 20:02:25+03:00,-10800,True,False,"['reporter.py', 'hosts.py', 'aks.py', 'kubelet.py']",['7e939b454464582d986015e5563a9e04be8dfbc1'],23,41,64,4,0.0,0.4666666666666667,1.0
3f174364f7fedf0f5b45732047d36c31061f9412,"Added cloud identifiering for each type of host scan, using azurespeed. Now AzuerSpn hunting will be triggered only if the host is an azure cluster. using predicate, and the new 'cloud' attribute",daniel_sagi,daniel.sagi@aquasec.com,daniel_sagi,daniel.sagi@aquasec.com,2018-06-12 12:10:59+03:00,-10800,2018-06-12 12:10:59+03:00,-10800,True,False,"['common.py', 'hosts.py', 'aks.py', 'kubelet.py']",['973c2a25a0f54a07c498dbc4a5bbb8fb2e3fadca'],14,28,42,4,1.0,1.0,0.25
110258770451c7b52bdf6d2497806707072d2999,"Added joining of queue at the end of the run, kube-hunter now stops alone",daniel_sagi,daniel.sagi@aquasec.com,daniel_sagi,daniel.sagi@aquasec.com,2018-06-12 12:40:21+03:00,-10800,2018-06-12 12:40:21+03:00,-10800,True,False,['kube-hunter.py'],['3f174364f7fedf0f5b45732047d36c31061f9412'],4,2,6,1,0.0,0.0,0.0
ca5c168bef962b41662f6d0575f21eca8da00297,changed order of rows in result table,daniel_sagi,daniel.sagi@aquasec.com,daniel_sagi,daniel.sagi@aquasec.com,2018-06-12 12:57:10+03:00,-10800,2018-06-12 12:57:10+03:00,-10800,True,False,['reporter.py'],['110258770451c7b52bdf6d2497806707072d2999'],5,15,20,1,0.0,0.0,1.0
e4c9beb653bc77fd6d338a4f83cfd80c77515209,added prove of running pods,daniel_sagi,daniel.sagi@aquasec.com,daniel_sagi,daniel.sagi@aquasec.com,2018-06-12 12:57:29+03:00,-10800,2018-06-12 12:57:29+03:00,-10800,True,False,['kubelet.py'],['ca5c168bef962b41662f6d0575f21eca8da00297'],2,15,17,1,1.0,1.0,1.0
c52e6842722ecca47c2799919c2d73c5d258be01,removed passing of active attribute to results printing,daniel_sagi,daniel.sagi@aquasec.com,daniel_sagi,daniel.sagi@aquasec.com,2018-06-12 13:16:35+03:00,-10800,2018-06-12 13:16:35+03:00,-10800,True,False,"['kube-hunter.py', 'reporter.py', 'handler.py', 'kubelet.py']",['e4c9beb653bc77fd6d338a4f83cfd80c77515209'],11,14,25,4,1.0,1.0,1.0
73a4e83781f674077009f0ba0b3b5ced50d76dfe,"Added checks on api responses before json.loads, added a quick scanning option, to scan part of the subnet",daniel_sagi,daniel.sagi@aquasec.com,daniel_sagi,daniel.sagi@aquasec.com,2018-06-12 14:30:28+03:00,-10800,2018-06-12 14:30:28+03:00,-10800,True,False,"['common.py', 'apiserver.py', 'hosts.py', 'aks.py', 'kubelet.py']",['c52e6842722ecca47c2799919c2d73c5d258be01'],61,73,134,5,0.75,0.0,0.75
c2e089b6a5d78e4dcbd2b7c839302610468d5417,removed unnecessary Information imports,daniel_sagi,daniel.sagi@aquasec.com,daniel_sagi,daniel.sagi@aquasec.com,2018-06-12 14:31:07+03:00,-10800,2018-06-12 14:31:07+03:00,-10800,True,False,"['kube-hunter.py', 'reporter.py']",['73a4e83781f674077009f0ba0b3b5ced50d76dfe'],1,2,3,2,,,
f3b9b5200fe7b2db4dd8f6facb39c8adfbdab1b0,added requirements.txt,daniel_sagi,daniel.sagi@aquasec.com,daniel_sagi,daniel.sagi@aquasec.com,2018-06-12 16:55:22+03:00,-10800,2018-06-12 16:55:22+03:00,-10800,True,False,"['reporter.py', 'requirements.txt', 'handler.py', 'hosts.py', 'aks.py']",['c2e089b6a5d78e4dcbd2b7c839302610468d5417'],3,16,19,5,1.0,1.0,1.0
1168a068af605eaefb86853b3353b25638da5da1,updated version packages,daniel_sagi,daniel.sagi@aquasec.com,daniel_sagi,daniel.sagi@aquasec.com,2018-06-12 17:13:17+03:00,-10800,2018-06-12 17:13:17+03:00,-10800,True,False,['requirements.txt'],['f3b9b5200fe7b2db4dd8f6facb39c8adfbdab1b0'],2,2,4,1,,,
fac667552edd7b67397e573124839ab9a32d3c86,"added cidr option, also added a while true when running on a pod, to halt for seeing results before restart",daniel_sagi,daniel.sagi@aquasec.com,daniel_sagi,daniel.sagi@aquasec.com,2018-06-17 19:01:23+03:00,-10800,2018-06-17 19:01:23+03:00,-10800,True,False,"['.gitignore', 'Dockerfile', 'kube-hunter.py', 'hosts.py']",['1168a068af605eaefb86853b3353b25638da5da1'],14,14,28,4,0.0,0.0,1.0
254b31f90c3ca08592809f3db9c4943b39efea50,chenged requirements back to no specific version of some packages,daniel_sagi,daniel.sagi@aquasec.com,daniel_sagi,daniel.sagi@aquasec.com,2018-06-17 19:02:17+03:00,-10800,2018-06-17 19:02:17+03:00,-10800,True,False,['requirements.txt'],['fac667552edd7b67397e573124839ab9a32d3c86'],3,3,6,1,,,
68e66da62d0c3790069ba5e5eb98181e77d6b79e,Added Readme,daniel_sagi,daniel.sagi@aquasec.com,daniel_sagi,daniel.sagi@aquasec.com,2018-06-17 19:03:36+03:00,-10800,2018-06-17 19:13:02+03:00,-10800,True,False,['README.md'],['254b31f90c3ca08592809f3db9c4943b39efea50'],0,66,66,1,,,
5055f9a809d4594829fe71afa0d24369c0dcdcdd,removed dockerignore,daniel_sagi,daniel.sagi@aquasec.com,daniel_sagi,daniel.sagi@aquasec.com,2018-06-17 19:15:49+03:00,-10800,2018-06-17 19:15:49+03:00,-10800,True,False,['.dockerignore'],['68e66da62d0c3790069ba5e5eb98181e77d6b79e'],1,0,1,1,,,
725161cab9b9dd20bfd7f0b890c4a6e73f5e0d42,Changed readme,daniel_sagi,daniel.sagi@aquasec.com,daniel_sagi,daniel.sagi@aquasec.com,2018-06-17 19:16:59+03:00,-10800,2018-06-17 19:16:59+03:00,-10800,True,False,"['.gitignore', 'README.md']",['5055f9a809d4594829fe71afa0d24369c0dcdcdd'],5,2,7,2,,,
54aa13d1b3b9e1429b9f7f757c4872ea74e5f664,Added mapping option,daniel_sagi,daniel.sagi@aquasec.com,daniel_sagi,daniel.sagi@aquasec.com,2018-06-18 10:46:03+03:00,-10800,2018-06-18 10:46:03+03:00,-10800,True,False,"['kube-hunter.py', 'reporter.py']",['725161cab9b9dd20bfd7f0b890c4a6e73f5e0d42'],8,35,43,2,0.8181818181818182,1.0,1.0
5f050046577bd921ea43235fe5205a603a75b1b0,changed README,daniel_sagi,daniel.sagi@aquasec.com,daniel_sagi,daniel.sagi@aquasec.com,2018-06-18 10:46:20+03:00,-10800,2018-06-18 10:47:38+03:00,-10800,True,False,['README.md'],['54aa13d1b3b9e1429b9f7f757c4872ea74e5f664'],9,28,37,1,,,
808ccdb1b5a88d13c25077a6a12fcb0719c35e07,added src README,daniel_sagi,daniel.sagi@aquasec.com,daniel_sagi,daniel.sagi@aquasec.com,2018-06-18 16:04:05+03:00,-10800,2018-06-18 16:26:49+03:00,-10800,True,False,['README.md'],['5f050046577bd921ea43235fe5205a603a75b1b0'],0,176,176,1,,,
b024660f55808a82b1aad5e94e0164314c8bfc28,added link to developer readme,daniel_sagi,daniel.sagi@aquasec.com,daniel_sagi,daniel.sagi@aquasec.com,2018-06-18 16:28:34+03:00,-10800,2018-06-18 16:28:34+03:00,-10800,True,False,['README.md'],['808ccdb1b5a88d13c25077a6a12fcb0719c35e07'],3,3,6,1,,,
dc830b12812fd99189dcf2566123a5e7b249e29d,changed README,daniel_sagi,daniel.sagi@aquasec.com,daniel_sagi,daniel.sagi@aquasec.com,2018-06-18 16:34:08+03:00,-10800,2018-06-18 16:42:50+03:00,-10800,True,False,['README.md'],['b024660f55808a82b1aad5e94e0164314c8bfc28'],3,7,10,1,,,
2b690056b0dfe1b211647019abeb9ef9f0f6df55,"Fixed type in privileged, also moved Components to core.types",daniel_sagi,daniel.sagi@aquasec.com,daniel_sagi,daniel.sagi@aquasec.com,2018-06-19 11:07:18+03:00,-10800,2018-06-19 11:07:18+03:00,-10800,True,False,"['common.py', 'types.py', 'kubelet.py', 'aks.py', 'kubelet.py', 'proxy.py']",['dc830b12812fd99189dcf2566123a5e7b249e29d'],21,22,43,6,,,
8c6712f3788c5181d5617723c538a9b153fdc07e,"1. Changed report methods and renamed ""log"" module to """", added another report generation in a new json format
2. started to add the --token option to send the finished report.
3. changed a bit of kubelet vulnerability output architecture to match out conventions.
4. added healthz check on kubelets",daniel_sagi,daniel.sagi@aquasec.com,daniel_sagi,daniel.sagi@aquasec.com,2018-06-20 12:09:36+03:00,-10800,2018-06-20 12:09:40+03:00,-10800,True,False,"['kube-hunter.py', 'reporter.py', '__init__.py', 'reporter.py', 'common.py', 'hosts.py', 'kubelet.py', 'kubelet.py']",['2b690056b0dfe1b211647019abeb9ef9f0f6df55'],178,297,475,8,0.49411764705882355,0.9647058823529412,1.0
464e7aad1fc5d316e3d5dc8bdb6d05d973240a3d,Added exception handling and improved help,daniel_sagi,daniel.sagi@aquasec.com,daniel_sagi,daniel.sagi@aquasec.com,2018-06-21 13:45:19+03:00,-10800,2018-06-21 13:45:19+03:00,-10800,True,False,"['kube-hunter.py', 'hosts.py', 'kubelet.py']",['8c6712f3788c5181d5617723c538a9b153fdc07e'],18,19,37,3,0.3333333333333333,0.3333333333333333,1.0
aa25e83a990a491a12e6f84d4f375ff532d88205,"moved report generation functions to inner functions, also added token flag, and the lambda url sending function",daniel_sagi,daniel.sagi@aquasec.com,daniel_sagi,daniel.sagi@aquasec.com,2018-06-21 19:47:10+03:00,-10800,2018-06-21 19:47:10+03:00,-10800,True,False,"['kube-hunter.py', 'reporter.py']",['464e7aad1fc5d316e3d5dc8bdb6d05d973240a3d'],51,58,109,2,0.0,0.0,1.0
03760724acfaa53593325906a0be423e2f6bb30b,"+ added report url handling on end of run, when specifiyng token",daniel_sagi,daniel.sagi@aquasec.com,daniel_sagi,daniel.sagi@aquasec.com,2018-06-27 14:13:49+03:00,-10800,2018-06-27 14:13:49+03:00,-10800,True,False,['reporter.py'],['aa25e83a990a491a12e6f84d4f375ff532d88205'],3,10,13,1,1.0,1.0,1.0
23c03afc02a8c5f081e4a6691ae911e097662ba7,added interactive choosing of scanning options,daniel_sagi,daniel.sagi@aquasec.com,daniel_sagi,daniel.sagi@aquasec.com,2018-07-02 16:20:14+03:00,-10800,2018-07-02 16:20:14+03:00,-10800,True,False,"['kube-hunter.py', 'hosts.py']",['03760724acfaa53593325906a0be423e2f6bb30b'],20,50,70,2,0.0,0.6785714285714286,1.0
e3a74b577eb4574540317cbb1d7d1fec33ee833f,Improve help message,Liz Rice,liz@lizrice.com,Liz Rice,liz@lizrice.com,2018-07-03 17:00:19+01:00,-3600,2018-07-03 17:00:19+01:00,-3600,True,False,['kube-hunter.py'],['2b690056b0dfe1b211647019abeb9ef9f0f6df55'],1,1,2,1,,,
76bd6d456ec34c3d31d14773f67e885d35ff2a90,Minor English corrections in the README,Liz Rice,liz@lizrice.com,Liz Rice,liz@lizrice.com,2018-07-03 17:10:09+01:00,-3600,2018-07-03 17:10:09+01:00,-3600,True,False,['README.md'],['e3a74b577eb4574540317cbb1d7d1fec33ee833f'],5,5,10,1,,,
16537e1ff6b4a453a712e474d46fbf2029bd30b1,changed a bit of report uploading process,daniel_sagi,daniel.sagi@aquasec.com,daniel_sagi,daniel.sagi@aquasec.com,2018-07-04 11:36:16+03:00,-10800,2018-07-04 11:36:32+03:00,-10800,True,False,"['kube-hunter.py', 'reporter.py']",['23c03afc02a8c5f081e4a6691ae911e097662ba7'],6,18,24,2,0.0,1.0,1.0
